Number Count,cleaned_questions,Array,String,Dynamic Programming,Math,Hash Table,Greedy,Sorting,Depth-First Search,Breadth-First Search,Binary Search
0,two sum given array integer nums integer target return index two number add target may assume input would exactly one solution may use element twice return answer order,1,0,0,0,1,0,0,0,0,0
1,add two number given two nonempty linked list representing two nonnegative integer digit stored reverse order node contains single digit add two number return sum linked list may assume two number contain leading zero except number itself,0,0,0,1,0,0,0,0,0,0
0,longest substring without repeating character given string find length longest substring without repeating character,0,1,0,0,1,0,0,0,0,0
2,median two sorted array given two sorted array nums nums size respectively return median two sorted array overall run time complexity olog,1,0,0,0,0,0,0,0,0,1
0,longest palindromic substring given string return longest palindromic substring,0,1,1,0,0,0,0,0,0,0
0,zigzag conversion string paypalishiring written zigzag pattern given number row like this you may want display pattern fixed font better legibility read line line pahnaplsiigyir write code take string make conversion given number row,0,1,0,0,0,0,0,0,0,0
7,reverse integer given signed bit integer return digit reversed reversing cause value outside signed bit integer range return assume environment allow store bit integer signed unsigned,0,0,0,1,0,0,0,0,0,0
1,string integer atoi implement myatoistring function convert string bit signed integer similar cc atoi function algorithm myatoistring follows note,0,1,0,0,0,0,0,0,0,0
0,palindrome number given integer return true palindrome integer integer palindrome read backward forward,0,0,0,1,0,0,0,0,0,0
0,regular expression matching given input string pattern implement regular expression matching support where matching cover entire input string not partial,0,1,1,0,0,0,0,0,0,0
1,container water given integer array height length vertical line drawn two endpoint ith line heighti find two line together xaxis form container container contains water return maximum amount water container store notice may slant container,1,0,0,0,0,1,0,0,0,0
3,integer roman roman numeral represented seven different symbol example written roman numeral two one added together written xii simply number written xxvii roman numeral usually written largest smallest left right however numeral four iiii instead number four written one five subtract making four principle applies number nine written six instance subtraction used given integer convert roman numeral,0,1,0,1,1,0,0,0,0,0
3,roman integer roman numeral represented seven different symbol example written roman numeral two one added together written xii simply number written xxvii roman numeral usually written largest smallest left right however numeral four iiii instead number four written one five subtract making four principle applies number nine written six instance subtraction used given roman numeral convert integer,0,1,0,1,1,0,0,0,0,0
0,longest common prefix write function find longest common prefix string amongst array string common prefix return empty string,0,1,0,0,0,0,0,0,0,0
2,sum given integer array nums return triplet numsi numsj numsk numsi numsj numsk notice solution set must contain duplicate triplet,1,0,0,0,0,0,1,0,0,0
1,sum closest given integer array nums length integer target find three integer nums sum closest target return sum three integer may assume input would exactly one solution,1,0,0,0,0,0,1,0,0,0
3,letter combination phone number given string containing digit inclusive return possible letter combination number could represent return answer order mapping digit letter just like telephone button given below note map letter,0,1,0,0,1,0,0,0,0,0
1,sum given array nums integer return array unique quadruplet numsa numsb numsc numsd that may return answer order,1,0,0,0,0,0,1,0,0,0
0,valid parenthesis given string containing character determine input string valid input string valid,0,1,0,0,0,0,0,0,0,0
0,generate parenthesis given pair parenthesis write function generate combination wellformed parenthesis,0,1,1,0,0,0,0,0,0,0
1,remove duplicate sorted array given integer array nums sorted nondecreasing order remove duplicate inplace unique element appears once relative order element kept same since impossible change length array language must instead result placed first part array nums formally element removing duplicate first element nums hold final result matter leave beyond first element return placing final result first slot nums allocate extra space another array must modifying input array inplace extra memory custom judge judge test solution following code assertion pas solution accepted,1,0,0,0,0,0,0,0,0,0
1,remove element given integer array nums integer val remove occurrence val nums inplace relative order element may changed since impossible change length array language must instead result placed first part array nums formally element removing duplicate first element nums hold final result matter leave beyond first element return placing final result first slot nums allocate extra space another array must modifying input array inplace extra memory custom judge judge test solution following code assertion pas solution accepted,1,0,0,0,0,0,0,0,0,0
2,implement strstr implement strstr given two string needle haystack return index first occurrence needle haystack needle part haystack clarification return needle empty string great question ask interview purpose problem return needle empty string consistent strstr java indexof,0,1,0,0,0,0,0,0,0,0
16,divide two integer given two integer dividend divisor divide two integer without using multiplication division mod operator integer division truncate toward zero mean losing fractional part example would truncated would truncated return quotient dividing dividend divisor note assume dealing environment could store integer within bit signed integer range problem quotient strictly greater return quotient strictly le return,0,0,0,1,0,0,0,0,0,0
0,substring concatenation word given string array string word length return starting index substring concatenation word word exactly once order without intervening character return answer order,0,1,0,0,1,0,0,0,0,0
0,next permutation permutation array integer arrangement member sequence linear order next permutation array integer next lexicographically greater permutation integer formally permutation array sorted one container according lexicographical order next permutation array permutation follows sorted container arrangement possible array must rearranged lowest possible order sorted ascending order given array integer nums find next permutation nums replacement must place use constant extra memory,1,0,0,0,0,0,0,0,0,0
0,longest valid parenthesis given string containing character find length longest valid wellformed parenthesis substring,0,1,1,0,0,0,0,0,0,0
23,search rotated sorted array integer array nums sorted ascending order with distinct value prior passed function nums possibly rotated unknown pivot index numslength resulting array numsk numsk numsn nums nums numsk indexed example might rotated pivot index become given array nums possible rotation integer target return index target nums nums must write algorithm olog runtime complexity,1,0,0,0,0,0,0,0,0,1
2,find first last position element sorted array given array integer nums sorted nondecreasing order find starting ending position given target value target found array return must write algorithm olog runtime complexity,1,0,0,0,0,0,0,0,0,1
0,search insert position given sorted array distinct integer target value return index target found not return index would inserted order must write algorithm olog runtime complexity,1,0,0,0,0,0,0,0,0,1
2,valid sudoku determine sudoku board valid filled cell need validated according following rule note,1,0,0,0,1,0,0,0,0,0
0,sudoku solver write program solve sudoku puzzle filling empty cell sudoku solution must satisfy following rule character indicates empty cell,1,0,0,0,0,0,0,0,0,0
1,count say countandsay sequence sequence digit string defined recursive formula determine say digit string split minimal number group group contiguous section character group say number character say character convert saying digit string replace count number concatenate every saying example saying conversion digit string given positive integer return nth term countandsay sequence,0,1,0,0,0,0,0,0,0,0
1,combination sum given array distinct integer candidate target integer target return list unique combination candidate chosen number sum target may return combination order number may chosen candidate unlimited number time two combination unique frequency least one chosen number different guaranteed number unique combination sum target le combination given input,1,0,0,0,0,0,0,0,0,0
0,combination sum given collection candidate number candidate target number target find unique combination candidate candidate number sum target number candidate may used combination note solution set must contain duplicate combination,1,0,0,0,0,0,0,0,0,0
0,first missing positive given unsorted integer array nums return smallest missing positive integer must implement algorithm run time us constant extra space,1,0,0,0,1,0,0,0,0,0
1,trapping rain water given nonnegative integer representing elevation map width bar compute much water trap raining,1,0,1,0,0,0,0,0,0,0
4,multiply string given two nonnegative integer num num represented string return product num num also represented string note must use builtin biginteger library convert input integer directly,0,1,0,1,0,0,0,0,0,0
0,wildcard matching given input string pattern implement wildcard pattern matching support where matching cover entire input string not partial,0,1,1,0,0,1,0,0,0,0
0,jump game given array nonnegative integer nums initially positioned first index array element array represents maximum jump length position goal reach last index minimum number jump assume always reach last index,1,0,1,0,0,1,0,0,0,0
0,permutation given array nums distinct integer return possible permutation return answer order,1,0,0,0,0,0,0,0,0,0
0,permutation given collection number nums might contain duplicate return possible unique permutation order,1,0,0,0,0,0,0,0,0,0
4,rotate image given matrix representing image rotate image degree clockwise rotate image inplace mean modify input matrix directly allocate another matrix rotation,1,0,0,1,0,0,0,0,0,0
0,group anagram given array string strs group anagram together return answer order anagram word phrase formed rearranging letter different word phrase typically using original letter exactly once,0,1,0,0,1,0,1,0,0,0
0,powx implement powx calculates raised power,0,0,0,1,0,0,0,0,0,0
0,nqueens nqueens puzzle problem placing queen chessboard two queen attack other given integer return distinct solution nqueens puzzle may return answer order solution contains distinct board configuration nqueens placement indicate queen empty space respectively,1,0,0,0,0,0,0,0,0,0
0,maximum subarray given integer array nums find contiguous subarray containing least one number largest sum return sum subarray contiguous part array,1,0,1,0,0,0,0,0,0,0
0,spiral matrix given matrix return element matrix spiral order,1,0,0,0,0,0,0,0,0,0
0,jump game given integer array nums initially positioned array first index element array represents maximum jump length position return true reach last index false otherwise,1,0,1,0,0,1,0,0,0,0
0,merge interval given array interval intervalsi starti endi merge overlapping interval return array nonoverlapping interval cover interval input,1,0,0,0,0,0,1,0,0,0
0,insert interval given array nonoverlapping interval interval intervalsi starti endi represent start end ith interval interval sorted ascending order starti also given interval newinterval start end represents start end another interval insert newinterval interval interval still sorted ascending order starti interval still overlapping interval merge overlapping interval necessary return interval insertion,1,0,0,0,0,0,0,0,0,0
0,length last word given string consisting word separated number space return length last word string word maximal substring consisting nonspace character only,0,1,0,0,0,0,0,0,0,0
2,spiral matrix given positive integer generate matrix filled element spiral order,1,0,0,0,0,0,0,0,0,0
4,permutation sequence set contains total unique permutation listing labeling permutation order get following sequence given return kth permutation sequence,0,0,0,1,0,0,0,0,0,0
6,unique path robot grid robot initially located topleft corner grid robot try move bottomright corner gridm robot move either right point time given two integer return number possible unique path robot take reach bottomright corner test case generated answer le equal,0,0,1,1,0,0,0,0,0,0
8,unique path given integer array grid robot initially located topleft corner grid robot try move bottomright corner gridmn robot move either right point time obstacle space marked respectively grid path robot take cannot include square obstacle return number possible unique path robot take reach bottomright corner testcases generated answer le equal,1,0,1,0,0,0,0,0,0,0
0,minimum path sum given grid filled nonnegative number find path top left bottom right minimizes sum number along path note move either right point time,1,0,1,0,0,0,0,0,0,0
33,valid number valid number split component order decimal number split component order integer split component order example following valid number following valid number abc given string return true valid number,0,1,0,0,0,0,0,0,0,0
1,plus one given large integer represented integer array digit digitsi ith digit integer digit ordered significant least significant lefttoright order large integer contain leading increment large integer one return resulting array digit,1,0,0,1,0,0,0,0,0,0
0,add binary given two binary string return sum binary string,0,1,0,1,0,0,0,0,0,0
0,text justification given array string word width maxwidth format text line exactly maxwidth character fully left right justified pack word greedy approach pack many word line pad extra space necessary line exactly maxwidth character extra space word distributed evenly possible number space line divide evenly word empty slot left assigned space slot right last line text leftjustified extra space inserted word note,1,1,0,0,0,0,0,0,0,0
4,sqrtx given nonnegative integer compute return square root since return type integer decimal digit truncated integer part result returned note allowed use builtin exponent function operator powx,0,0,0,1,0,0,0,0,0,1
2,climbing stair climbing staircase take step reach top time either climb step many distinct way climb top,0,0,1,1,0,0,0,0,0,0
0,simplify path given string path absolute path starting slash file directory unixstyle file system convert simplified canonical path unixstyle file system period refers current directory double period refers directory level multiple consecutive slash treated single slash problem format period treated filedirectory name canonical path following format return simplified canonical path,0,1,0,0,0,0,0,0,0,0
4,edit distance given two string word word return minimum number operation required convert word word following three operation permitted word,0,1,1,0,0,0,0,0,0,0
2,set matrix zero given integer matrix matrix element set entire row column must place,1,0,0,0,1,0,0,0,0,0
1,search matrix write efficient algorithm search value target integer matrix matrix matrix following property,1,0,0,0,0,0,0,0,0,1
3,sort color given array nums object colored red white blue sort inplace object color adjacent color order red white blue use integer represent color red white blue respectively must solve problem without using library sort function,1,0,0,0,0,0,1,0,0,0
0,minimum window substring given two string length respectively return minimum window substring every character including duplicate included window substring return empty string testcases generated answer unique substring contiguous sequence character within string,0,1,0,0,1,0,0,0,0,0
0,subset given integer array nums unique element return possible subset the power set solution set must contain duplicate subset return solution order,1,0,0,0,0,0,0,0,0,0
0,word search given grid character board string word return true word exists grid word constructed letter sequentially adjacent cell adjacent cell horizontally vertically neighboring letter cell may used once,1,0,0,0,0,0,0,0,0,0
1,remove duplicate sorted array given integer array nums sorted nondecreasing order remove duplicate inplace unique element appears twice relative order element kept same since impossible change length array language must instead result placed first part array nums formally element removing duplicate first element nums hold final result matter leave beyond first element return placing final result first slot nums allocate extra space another array must modifying input array inplace extra memory custom judge judge test solution following code assertion pas solution accepted,1,0,0,0,0,0,0,0,0,0
28,search rotated sorted array integer array nums sorted nondecreasing order not necessarily distinct value passed function nums rotated unknown pivot index numslength resulting array numsk numsk numsn nums nums numsk indexed example might rotated pivot index become given array nums rotation integer target return true target nums false nums must decrease overall operation step much possible,1,0,0,0,0,0,0,0,0,1
1,largest rectangle histogram given array integer height representing histogram bar height width bar return area largest rectangle histogram,1,0,0,0,0,0,0,0,0,0
3,maximal rectangle given row col binary matrix filled find largest rectangle containing return area,1,0,1,0,0,0,0,0,0,0
4,scramble string scramble string get string using following algorithm given two string length return true scrambled string otherwise return false,0,1,1,0,0,0,0,0,0,0
10,merge sorted array given two integer array nums nums sorted nondecreasing order two integer representing number element nums nums respectively merge nums nums single array sorted nondecreasing order final sorted array returned function instead stored inside array nums accommodate this nums length first element denote element merged last element set ignored nums length,1,0,0,0,0,0,1,0,0,0
1,gray code nbit gray code sequence sequence integer where given integer return valid nbit gray code sequence,0,0,0,1,0,0,0,0,0,0
0,subset given integer array nums may contain duplicate return possible subset the power set solution set must contain duplicate subset return solution order,1,0,0,0,0,0,0,0,0,0
8,decode way message containing letter encoded number using following mapping decode encoded message digit must grouped mapped back letter using reverse mapping there may multiple way example mapped into note grouping invalid cannot mapped since different given string containing digit return number way decode test case generated answer fit bit integer,0,1,1,0,0,0,0,0,0,0
2,restore address valid address consists exactly four integer separated single dot integer inclusive cannot leading zero given string containing digit return possible valid address formed inserting dot allowed reorder remove digit may return valid address order,0,1,0,0,0,0,0,0,0,0
0,binary tree inorder traversal given root binary tree return inorder traversal node value,0,0,0,0,0,0,0,1,0,0
1,unique binary search tree given integer return structurally unique bsts binary search tree exactly node unique value return answer order,0,0,1,0,0,0,0,0,0,0
1,unique binary search tree given integer return number structurally unique bsts binary search tree exactly node unique value,0,0,1,1,0,0,0,0,0,0
6,interleaving string given string find whether formed interleaving interleaving two string configuration divided nonempty substring that note concatenation string,0,1,1,0,0,0,0,0,0,0
0,validate binary search tree given root binary tree determine valid binary search tree bst valid bst defined follows,0,0,0,0,0,0,0,1,0,0
0,recover binary search tree given root binary search tree bst value exactly two node tree swapped mistake recover tree without changing structure,0,0,0,0,0,0,0,1,0,0
0,tree given root two binary tree write function check not two binary tree considered structurally identical node value,0,0,0,0,0,0,0,1,1,0
0,symmetric tree given root binary tree check whether mirror symmetric around center,0,0,0,0,0,0,0,1,1,0
0,binary tree level order traversal given root binary tree return level order traversal node value left right level level,0,0,0,0,0,0,0,0,1,0
0,binary tree zigzag level order traversal given root binary tree return zigzag level order traversal node value left right right left next level alternate between,0,0,0,0,0,0,0,0,1,0
0,maximum depth binary tree given root binary tree return maximum depth binary tree maximum depth number node along longest path root node farthest leaf node,0,0,0,0,0,0,0,1,1,0
0,construct binary tree preorder inorder traversal given two integer array preorder inorder preorder preorder traversal binary tree inorder inorder traversal tree construct return binary tree,1,0,0,0,1,0,0,0,0,0
0,construct binary tree inorder postorder traversal given two integer array inorder postorder inorder inorder traversal binary tree postorder postorder traversal tree construct return binary tree,1,0,0,0,1,0,0,0,0,0
0,binary tree level order traversal given root binary tree return bottomup level order traversal node value left right level level leaf root,0,0,0,0,0,0,0,0,1,0
0,convert sorted array binary search tree given integer array nums element sorted ascending order convert heightbalanced binary search tree heightbalanced binary tree binary tree depth two subtrees every node never differs one,1,0,0,0,0,0,0,0,0,0
1,balanced binary tree given binary tree determine heightbalanced problem heightbalanced binary tree defined binary tree left right subtrees every node differ height,0,0,0,0,0,0,0,1,0,0
0,minimum depth binary tree given binary tree find minimum depth minimum depth number node along shortest path root node nearest leaf node note leaf node child,0,0,0,0,0,0,0,1,1,0
0,path sum given root binary tree integer targetsum return true tree roottoleaf path adding value along path equal targetsum leaf node child,0,0,0,0,0,0,0,1,1,0
0,path sum given root binary tree integer targetsum return roottoleaf path sum node value path equal targetsum path returned list node value node reference roottoleaf path path starting root ending leaf node leaf node child,0,0,0,0,0,0,0,1,0,0
0,flatten binary tree linked list given root binary tree flatten tree linked list,0,0,0,0,0,0,0,1,0,0
1,distinct subsequence given two string return number distinct subsequence equal string subsequence new string formed original string deleting can none character without disturbing remaining character relative position ace subsequence abcde aec not test case generated answer fit bit signed integer,0,1,1,0,0,0,0,0,0,0
0,populating next right pointer node given perfect binary tree leaf level every parent two child binary tree following definition populate next pointer point next right node next right node next pointer set null initially next pointer set null,0,0,0,0,0,0,0,1,1,0
0,populating next right pointer node given binary tree populate next pointer point next right node next right node next pointer set null initially next pointer set null,0,0,0,0,0,0,0,1,1,0
0,pascal triangle given integer numrows return first numrows pascal triangle pascal triangle number sum two number directly shown,1,0,1,0,0,0,0,0,0,0
1,pascal triangle given integer rowindex return rowindexth indexed row pascal triangle pascal triangle number sum two number directly shown,1,0,1,0,0,0,0,0,0,0
1,triangle given triangle array return minimum path sum top bottom step may move adjacent number row below formally index current row may move either index index next row,1,0,1,0,0,0,0,0,0,0
1,best time buy sell stock given array price pricesi price given stock ith day want maximize profit choosing single day buy one stock choosing different day future sell stock return maximum profit achieve transaction cannot achieve profit return,1,0,1,0,0,0,0,0,0,0
0,best time buy sell stock given integer array price pricesi price given stock ith day day may decide buy andor sell stock hold one share stock time however buy immediately sell day find return maximum profit achieve,1,0,1,0,0,1,0,0,0,0
0,best time buy sell stock iii given array price pricesi price given stock ith day find maximum profit achieve may complete two transaction note may engage multiple transaction simultaneously must sell stock buy again,1,0,1,0,0,0,0,0,0,0
0,binary tree maximum path sum path binary tree sequence node pair adjacent node sequence edge connecting them node appear sequence once note path need pas root path sum path sum node value path given root binary tree return maximum path sum nonempty path,0,0,1,0,0,0,0,1,0,0
0,valid palindrome phrase palindrome converting uppercase letter lowercase letter removing nonalphanumeric character read forward backward alphanumeric character include letter number given string return true palindrome false otherwise,0,1,0,0,0,0,0,0,0,0
4,word ladder transformation sequence word beginword word endword using dictionary wordlist sequence word beginword that given two word beginword endword dictionary wordlist return shortest transformation sequence beginword endword empty list sequence exists sequence returned list word beginword,0,1,0,0,1,0,0,0,1,0
3,word ladder transformation sequence word beginword word endword using dictionary wordlist sequence word beginword that given two word beginword endword dictionary wordlist return number word shortest transformation sequence beginword endword sequence exists,0,1,0,0,1,0,0,0,1,0
0,longest consecutive sequence given unsorted array integer nums return length longest consecutive element sequence must write algorithm run time,1,0,0,0,1,0,0,0,0,0
