Number Count,cleaned_questions,Array,String,Dynamic Programming,Math,Hash Table,Greedy,Sorting,Depth-First Search,Breadth-First Search,Binary Search
15,exclusive time function singlethreaded cpu execute program containing function function unique function call stored call stack function call start pushed onto stack function call end popped stack function whose top stack current function executed time function start end write log whether started ended timestamp given list log logsi represents ith log message formatted string functionidstart endtimestamp example start mean function call function started beginning timestamp end mean function call function ended end timestamp note function called multiple time possibly recursively function exclusive time sum execution time function call program example function called twice one call executing time unit another call executing time unit exclusive time return exclusive time function array value ith index represents exclusive time function,1,0,0,0,0,0,0,0,0,0
1,shopping offer leetcode store item sell item price however special offer special offer consists one different kind item sale price given integer array price pricei price ith item integer array need needsi number piece ith item want buy also given array special speciali size specialij number piece jth item ith offer specialin last integer array price ith offer return lowest price pay exactly certain item given could make optimal use special offer allowed buy item want even would lower overall price could use special offer many time want,1,0,1,0,0,0,0,0,0,0
23,decode way message containing letter encoded number using following mapping decode encoded message digit must grouped mapped back letter using reverse mapping there may multiple way example mapped into note grouping invalid cannot mapped since different addition mapping above encoded message may contain character represent digit excluded example encoded message may represent encoded message decoding equivalent decoding encoded message represent given string consisting digit character return number way decode since answer may large return modulo,0,1,1,0,0,0,0,0,0,0
0,solve equation solve given equation return value form string xvalue equation contains operation variable coefficient return solution solution equation infinite solution infinite solution equation exactly one solution equation ensure value integer,0,1,0,1,0,0,0,0,0,0
2,maximum average subarray given integer array nums consisting element integer find contiguous subarray whose length equal maximum average value return value answer calculation error le accepted,1,0,0,0,0,0,0,0,0,0
1,set mismatch set integer originally contains number unfortunately due error one number got duplicated another number set result repetition one number loss another number given integer array nums representing data status set error find number occurs twice number missing return form array,1,0,0,0,1,0,1,0,0,0
2,maximum length pair chain given array pair pair pairsi lefti righti lefti righti pair follows pair chain pair formed fashion return length longest chain formed need use given interval select pair order,1,0,1,0,0,1,1,0,0,0
0,palindromic substring given string return number palindromic substring string palindrome read backward forward substring contiguous sequence character within string,0,1,1,0,0,0,0,0,0,0
0,replace word english concept called root followed word form another longer word let call word successor example root followed successor word other form new word another given dictionary consisting many root sentence consisting word separated space replace successor sentence root forming successor replaced one root replace root shortest length return sentence replacement,1,1,0,0,1,0,0,0,0,0
5,dota senate world dota two party radiant dire dota senate consists senator coming two party senate want decide change dota game voting change roundbased procedure round senator exercise one two right given string senate representing senator party belonging character represent radiant party dire party senator size given string roundbased procedure start first senator last senator given order procedure last end voting senator lost right skipped procedure suppose every senator smart enough play best strategy party predict party finally announce victory change dota game output radiant dire,0,1,0,0,0,1,0,0,0,0
1,key keyboard one character screen notepad perform one two operation notepad step given integer return minimum number operation get character exactly time screen,0,0,1,1,0,0,0,0,0,0
0,find duplicate subtrees given root binary tree return duplicate subtrees kind duplicate subtrees need return root node one them two tree duplicate structure node value,0,0,0,0,1,0,0,1,0,0
0,two sum input bst given root binary search tree target number return true exist two element bst sum equal given target,0,0,0,0,1,0,0,1,1,0
0,maximum binary tree given integer array nums duplicate maximum binary tree built recursively nums using following algorithm return maximum binary tree built nums,1,0,0,0,0,0,0,0,0,0
1,print binary tree given root binary tree construct indexed string matrix re represents formatted layout tree formatted layout matrix constructed using following rule return constructed matrix re,0,0,0,0,0,0,0,1,1,0
5,robot return origin robot starting position origin plane given sequence move judge robot end completes move given string move represents move sequence robot movesi represents ith move valid move right left down return true robot return origin finish move false otherwise note way robot facing irrelevant always make robot move right once always make move left etc also assume magnitude robot movement move,0,1,0,0,0,0,0,0,0,0
0,find closest element given sorted integer array arr two integer return closest integer array result also sorted ascending order integer closer integer,1,0,0,0,0,0,1,0,0,1
11,split array consecutive subsequence given integer array nums sorted nondecreasing order determine possible split nums one subsequence following condition true return true split nums according condition false otherwise subsequence array new array formed original array deleting can none element without disturbing relative position remaining element subsequence not,1,0,0,0,1,1,0,0,0,0
2,image smoother image smoother filter size applied cell image rounding average cell eight surrounding cell average nine cell blue smoother one surrounding cell cell present consider average average four cell red smoother given integer matrix img representing grayscale image return image applying smoother cell,1,0,0,0,0,0,0,0,0,0
1,maximum width binary tree given root binary tree return maximum width given tree maximum width tree maximum width among level width one level defined length endnodes the leftmost rightmost nonnull node null node endnodes would present complete binary tree extending level also counted length calculation guaranteed answer range bit signed integer,0,0,0,0,0,0,0,1,1,0
0,strange printer strange printer following two special property given string return minimum number turn printer needed print,0,1,1,0,0,0,0,0,0,0
4,nondecreasing array given array nums integer task check could become nondecreasing modifying one element define array nondecreasing numsi numsi hold every based,1,0,0,0,0,0,0,0,0,0
1,beautiful arrangement given two integer construct list answer contains different positive integer ranging obeys following requirement return list answer multiple valid answer return them,1,0,0,1,0,0,0,0,0,0
1,kth smallest number multiplication table nearly everyone used multiplication table multiplication table size integer matrix mat matij indexed given three integer return kth smallest element multiplication table,0,0,0,0,0,0,0,0,0,1
0,trim binary search tree given root binary search tree lowest highest boundary low high trim tree element lie low high trimming tree change relative structure element remain tree node descendant remain descendant proven unique answer return root trimmed binary search tree note root may change depending given bound,0,0,0,0,0,0,0,1,0,0
0,maximum swap given integer num swap two digit get maximum valued number return maximum valued number get,0,0,0,1,0,1,0,0,0,0
1,second minimum node binary tree given nonempty special binary tree consisting node nonnegative value node tree exactly two zero subnode node two subnodes node value smaller value among two subnodes formally property rootval minrootleftval rootrightval always hold given binary tree need output second minimum value set made node value whole tree second minimum value exists output instead,0,0,0,0,0,0,0,1,0,0
1,bulb switcher room bulb labeled turned initially four button wall four button different functionality where must make exactly press button press total press may pick four button press given two integer press return number different possible status performing press button press,0,0,0,1,0,0,0,1,1,0
0,number longest increasing subsequence given integer array nums return number longest increasing subsequence notice sequence strictly increasing,1,0,1,0,0,0,0,0,0,0
3,longest continuous increasing subsequence given unsorted array integer nums return length longest continuous increasing subsequence subarray subsequence must strictly increasing continuous increasing subsequence defined two index numsl numsl numsr numsr numsi numsi,1,0,0,0,0,0,0,0,0,0
4,cut tree golf event asked cut tree forest golf event forest represented matrix matrix one step walk four direction north east south west standing cell tree choose whether cut off must cut tree order shortest tallest cut tree value cell becomes empty cell starting point return minimum step need walk cut tree cannot cut tree return guaranteed two tree height least one tree need cut off,1,0,0,0,0,0,0,0,1,0
0,implement magic dictionary design data structure initialized list different word provided string determine change exactly one character string match word data structure implement magicdictionary class,0,1,0,0,1,0,0,0,0,0
0,map sum pair design map allows following implement mapsum class,0,1,0,0,1,0,0,0,0,0
0,valid parenthesis string given string containing three type character return true valid following rule define valid string,0,1,1,0,0,1,0,0,0,0
6,game given integer array card length four card containing number range arrange number card mathematical expression using operator parenthesis get value restricted following rule return true get expression evaluates false otherwise,1,0,0,1,0,0,0,0,0,0
0,valid palindrome given string return true palindrome deleting one character,0,1,0,0,0,1,0,0,0,0
1,baseball game keeping score baseball game strange rule game consists several round score past round may affect future round score beginning game start empty record given list string ops opsi ith operation must apply record one following return sum score record test case generated answer fit bit integer,1,0,0,0,0,0,0,0,0,0
2,redundant connection problem tree undirected graph connected cycle given graph started tree node labeled one additional edge added added edge two different vertex chosen edge already existed graph represented array edge length edgesi indicates edge node graph return edge removed resulting graph tree node multiple answer return answer occurs last input,0,0,0,0,0,0,0,1,1,0
4,redundant connection problem rooted tree directed graph that exactly one node the root node descendant node plus every node exactly one parent except root node parent given input directed graph started rooted tree node with distinct value one additional directed edge added added edge two different vertex chosen edge already existed resulting graph given darray edge element edge pair represents directed edge connecting node parent child return edge removed resulting graph rooted tree node multiple answer return answer occurs last given darray,0,0,0,0,0,0,0,1,1,0
4,repeated string match given two string return minimum number time repeat string string substring impossible b​​​​​​ substring repeating return notice string abc repeated time repeated time abc repeated time abcabc,0,1,0,0,0,0,0,0,0,0
0,longest univalue path given root binary tree return length longest path node path value path may may pas root length path two node represented number edge them,0,0,0,0,0,0,0,1,0,0
5,knight probability chessboard chessboard knight start cell row column attempt make exactly move row column indexed topleft cell bottomright cell chess knight eight possible move make illustrated below move two cell cardinal direction one cell orthogonal direction time knight move chooses one eight possible move uniformly random even piece would chessboard move there knight continues moving made exactly move moved chessboard return probability knight remains board stopped moving,0,0,1,0,0,0,0,0,0,0
2,maximum sum nonoverlapping subarrays given integer array nums integer find three nonoverlapping subarrays length maximum sum return them return result list index representing starting position interval indexed multiple answer return lexicographically smallest one,1,0,1,0,0,0,0,0,0,0
0,employee importance data structure employee information including employee unique importance value direct subordinate id given array employee employee where given integer represents employee return total importance value employee direct indirect subordinate,0,0,0,0,1,0,0,1,1,0
2,sticker spell word given different type sticker sticker lowercase english word would like spell given string target cutting individual letter collection sticker rearranging them use sticker want infinite quantity sticker return minimum number sticker need spell target task impossible return note test case word chosen randomly common english word target chosen concatenation two random word,0,0,1,0,0,0,0,0,0,0
0,top frequent word given array string word integer return frequent string return answer sorted frequency highest lowest sort word frequency lexicographical order,0,1,0,0,1,0,1,0,0,0
4,max area island given binary matrix grid island group representing land connected directionally horizontal vertical may assume four edge grid surrounded water area island number cell value island return maximum area island grid island return,1,0,0,0,0,0,0,1,1,0
4,count binary substring give binary string return number nonempty substring number substring grouped consecutively substring occur multiple time counted number time occur,0,1,0,0,0,0,0,0,0,0
0,degree array given nonempty array nonnegative integer nums degree array defined maximum frequency one element task find smallest possible length contiguous subarray nums degree nums,1,0,0,0,1,0,0,0,0,0
0,partition equal sum subset given integer array nums integer return true possible divide array nonempty subset whose sum equal,1,0,1,0,0,0,0,0,0,0
2,falling square several square dropped onto xaxis plane given integer array position positionsi lefti sidelengthi represents ith square side length sidelengthi dropped left edge aligned xcoordinate lefti square dropped one time height landed square fall downward negative direction either land top side another square xaxis square brushing leftright side another square count landing land freeze place cannot moved square dropped must record height current tallest stack square return integer array an ansi represents height described dropping ith square,1,0,0,0,0,0,0,0,0,0
2,minimum ascii delete sum two string given two string return lowest ascii sum deleted character make two string equal,0,1,1,0,0,0,0,0,0,0
0,subarray product le given array integer nums integer return number contiguous subarrays product element subarray strictly le,1,0,0,0,0,0,0,0,0,0
0,best time buy sell stock transaction fee given array price pricesi price given stock ith day integer fee representing transaction fee find maximum profit achieve may complete many transaction like need pay transaction fee transaction note may engage multiple transaction simultaneously must sell stock buy again,1,0,1,0,0,1,0,0,0,0
3,bit bit character two special character given binary array bit end return true last character must onebit character,1,0,0,0,0,0,0,0,0,0
2,maximum length repeated subarray given two integer array nums nums return maximum length subarray appears array,1,0,1,0,0,0,0,0,0,1
1,find kth smallest pair distance distance pair integer defined absolute difference given integer array nums integer return kth smallest distance among pair numsi numsj numslength,1,0,0,0,0,0,1,0,0,1
0,longest word dictionary given array string word representing english dictionary return longest word word built one character time word word one possible answer return longest word smallest lexicographical order answer return empty string,1,1,0,0,1,0,1,0,0,0
1,account merge given list account element accountsi list string first element accountsi name rest element email representing email account now would like merge account two account definitely belong person common email account note even two account name may belong different people people could name person number account initially account definitely name merging account return account following format first element account name rest element email sorted order account returned order,1,1,0,0,0,0,0,1,1,0
0,remove comment given program remove comment program source array string source sourcei ith line source code represents result splitting original source code string newline character two type comment line comment block comment first effective comment take precedence others certain line code empty removing comment must output line string answer list nonempty control character single quote double quote character also nothing else defines macro interfere comment guaranteed every open block comment eventually closed outside line block comment always start new comment finally implicit newline character deleted block comment please see example detail removing comment source code return source code format,1,1,0,0,0,0,0,0,0,0
2,find pivot index given array integer nums calculate pivot index array pivot index index sum number strictly left index equal sum number strictly index right index left edge array left sum element left also applies right edge array return leftmost pivot index index exists return,1,0,0,0,0,0,0,0,0,0
5,number atom given string formula representing chemical formula return count atom atomic element always start uppercase character zero lowercase letter representing name one digit representing element count may follow count greater count digit follow two formula concatenated together produce another formula formula placed parenthesis count optionally added also formula return count element string following form first name sorted order followed count count followed second name sorted order followed count count test case generated value output fit bit integer,0,1,0,0,1,0,1,0,0,0
0,self dividing number selfdividing number number divisible every digit contains selfdividing number allowed contain digit zero given two integer left right return list selfdividing number range left right,0,0,0,1,0,0,0,0,0,0
6,count different palindromic subsequence given string return number different nonempty palindromic subsequence since answer may large return modulo subsequence string obtained deleting zero character string sequence palindromic equal sequence reversed two sequence different,0,1,1,0,0,0,0,0,0,0
2,flood fill image represented integer grid image imageij represents pixel value image also given three integer newcolor perform flood fill image starting pixel imagesrsc perform flood fill consider starting pixel plus pixel connected directionally starting pixel color starting pixel plus pixel connected directionally pixel also color replace color aforementioned pixel newcolor return modified image performing flood fill,1,0,0,0,0,0,0,1,1,0
0,asteroid collision given array asteroid integer representing asteroid row asteroid absolute value represents size sign represents direction positive meaning right negative meaning left asteroid move speed find state asteroid collision two asteroid meet smaller one explode size explode two asteroid moving direction never meet,1,0,0,0,0,0,0,0,0,0
0,parse lisp expression given string expression representing lisplike expression return integer value syntax expression given follows,0,1,0,0,1,0,0,0,0,0
0,monotone increasing digit integer monotone increasing digit pair adjacent digit satisfy given integer return largest number le equal monotone increasing digit,0,0,0,1,0,1,0,0,0,0
1,daily temperature given array integer temperature represents daily temperature return array answer answeri number day wait ith day get warmer temperature future day possible keep answeri instead,1,0,0,0,0,0,0,0,0,0
0,delete earn given integer array nums want maximize number point get performing following operation number time return maximum number point earn applying operation number time,1,0,1,0,1,0,0,0,0,0
0,cherry pickup given grid representing field cherry cell one three possible integer return maximum number cherry collect following rule below,1,0,1,0,0,0,0,0,0,0
0,lower case given string return string replacing every uppercase letter lowercase letter,0,1,0,0,0,0,0,0,0,0
2,network delay time given network node labeled also given time list travel time directed edge timesi source node target node time take signal travel source target send signal given node return time take node receive signal impossible node receive signal return,0,0,0,0,0,0,0,1,1,0
0,find smallest letter greater target given character array letter sorted nondecreasing order character target return smallest character array larger target note letter wrap around,1,0,0,0,0,0,0,0,0,1
0,prefix suffix search design special dictionary word search word prefix suffix implement wordfilter class,0,1,0,0,0,0,0,0,0,0
2,min cost climbing stair given integer array cost costi cost ith step staircase pay cost either climb one two step either start step index step index return minimum cost reach top floor,1,0,1,0,0,0,0,0,0,0
1,largest number least twice others given integer array nums largest integer unique determine whether largest element array least twice much every number array return index largest element return otherwise,1,0,0,0,0,0,1,0,0,0
1,shortest completing word given string licenseplate array string word find shortest completing word word completing word word contains letter licenseplate ignore number space licenseplate treat letter case insensitive letter appears licenseplate must appear word number time more example licenseplate abc contains letter ignoring case twice possible completing word abccdef caaacab cbca return shortest completing word word guaranteed answer exists multiple shortest completing word return first one occurs word,1,1,0,0,1,0,0,0,0,0
3,contain virus virus spreading rapidly task quarantine infected area installing wall world modeled binary grid isinfected isinfectedij represents uninfected cell isinfectedij represents cell contaminated virus wall and one wall installed two directionally adjacent cell shared boundary every night virus spread neighboring cell four direction unless blocked wall resource limited day install wall around one region affected area continuous block infected cell threatens uninfected cell following night never tie return number wall used quarantine infected region world become fully infected return number wall used,1,0,0,0,0,0,0,1,1,0
19,open lock lock front circular wheel wheel slot wheel rotate freely wrap around example turn move consists turning one wheel one slot lock initially start string representing state wheel given list deadends dead end meaning lock display code wheel lock stop turning unable open given target representing value wheel unlock lock return minimum total number turn required open lock impossible,1,1,0,0,1,0,0,0,1,0
2,cracking safe safe protected password password sequence digit digit range safe peculiar way checking password enter sequence check recent digit entered time type digit return string minimum length unlock safe point entering,0,0,0,0,0,0,0,1,0,0
1,reach number standing position infinite number line destination position target make number move nummoves that given integer target return minimum number move required minimum nummoves reach destination,0,0,0,1,0,0,0,0,0,1
0,pyramid transition matrix stacking block form pyramid block color represented single letter row block contains one le block row beneath centered top make pyramid aesthetically pleasing specific triangular pattern allowed triangular pattern consists single block stacked top two block pattern given list threeletter string allowed first two character pattern represent left right bottom block respectively third character top block start bottom row block bottom given single string must use base pyramid given bottom allowed return true build pyramid way top every triangular pattern pyramid allowed false otherwise,0,0,0,0,0,0,0,1,1,0
0,set intersection size least two integer interval for integer set consecutive integer including find minimum size set every integer interval interval intersection size least two,1,0,0,0,0,1,1,0,0,0
0,special binary string special binary string binary string following two property given special binary string move consists choosing two consecutive nonempty special substring swapping them two string consecutive last character first string exactly one index first character second string return lexicographically largest resulting string possible applying mentioned operation string,0,1,0,0,0,0,0,0,0,0
0,nary tree level order traversal given nary tree return level order traversal node value narytree input serialization represented level order traversal group child separated null value see example,0,0,0,0,0,0,0,0,1,0
