Number Count,cleaned_questions,Array,String,Dynamic Programming,Math,Hash Table,Greedy,Sorting,Depth-First Search,Breadth-First Search,Binary Search
3,validate binary tree node binary tree node numbered node two child leftchildi rightchildi return true given node form exactly one valid binary tree node left child leftchildi equal similarly right child note node value use node number problem,0,0,0,0,0,0,0,1,1,0
2,closest divisor given integer num find closest two integer absolute difference whose product equal num num return two integer order,0,0,0,1,0,0,0,0,0,0
0,largest multiple three given array digit digit return largest multiple three formed concatenating given digit order answer return empty string since answer may fit integer data type return answer string note returning answer must contain unnecessary leading zero,1,0,1,0,0,1,0,0,0,0
6,prime arrangement return number permutation prime number prime index indexed recall integer prime greater cannot written product two positive integer smaller since answer may large return answer modulo,0,0,0,1,0,0,0,0,0,0
2,make palindrome substring given string array query queriesi lefti righti may rearrange substring sleftirighti query choose replace lowercase english letter substring possible palindrome string operation above result query true otherwise result false return boolean array answer answeri result ith query queriesi note letter counted individually replacement example sleftirighti aaa replace two letter also note query modifies initial string example example constraint,0,1,0,0,1,0,0,0,0,0
0,reformat date given date string form day month year where convert date string format yyyymmdd where,0,1,0,0,0,0,0,0,0,0
1,four divisor given integer array nums return sum divisor integer array exactly four divisor integer array return,1,0,0,1,0,0,0,0,0,0
1,balance binary search tree given root binary search tree return balanced binary search tree node value one answer return them binary search tree balanced depth two subtrees every node never differs,0,0,0,0,0,1,0,1,0,0
0,constrained subsequence sum given integer array nums integer return maximum sum nonempty subsequence array every two consecutive integer subsequence numsi numsj condition satisfied subsequence array obtained deleting number element can zero array leaving remaining element original order,1,0,1,0,0,0,0,0,0,0
3,distance bus stop bus stop numbered form circle know distance pair neighboring stop distancei distance stop number bus go along direction clockwise counterclockwise return shortest distance given start destination stop,1,0,0,0,0,0,0,0,0,0
0,maximum subarray sum one deletion given array integer return maximum sum nonempty subarray contiguous element one element deletion word want choose subarray optionally delete one element still least one element left sum remaining element maximum possible note subarray need nonempty deleting one element,1,0,1,0,0,0,0,0,0,0
0,day week given date return corresponding day week date input given three integer representing day month year respectively return answer one following value sunday monday tuesday wednesday thursday friday saturday,0,0,0,1,0,0,0,0,0,0
11,make array strictly increasing given two integer array arr arr return minimum number operation possibly zero needed make arr strictly increasing one operation choose two index arrlength arrlength assignment arri arrj way make arr strictly increasing return,1,0,1,0,0,0,0,0,0,1
0,range frequency query design data structure find frequency given value given subarray frequency value subarray number occurrence value subarray implement rangefreqquery class subarray contiguous sequence element within array arrleftright denotes subarray contains element nums index left right inclusive,1,0,0,0,1,0,0,0,0,1
3,minimum garden perimeter collect enough apple garden represented infinite grid apple tree planted every integer coordinate apple tree planted integer coordinate apple growing buy axisaligned square plot land centered given integer neededapples return minimum perimeter plot least neededapples apple inside perimeter plot value defined,0,0,0,1,0,0,0,0,0,1
3,kth ancestor tree node given tree node numbered form parent array parent parenti parent ith node root tree node find kth ancestor given node kth ancestor tree node kth node path node root node implement treeancestor class,0,0,1,0,0,0,0,1,1,1
0,maximum number balloon given string text want use character text form many instance word balloon possible use character text once return maximum number instance formed,0,1,0,0,1,0,0,0,0,0
0,reverse substring pair parenthesis given string consists lower case english letter bracket reverse string pair matching parenthesis starting innermost one result contain bracket,0,1,0,0,0,0,0,0,0,0
13,kconcatenation maximum sum given integer array arr integer modify array repeating time example arr modified array return maximum subarray sum modified array note length subarray sum case answer large return answer modulo,1,0,1,0,0,0,0,0,0,0
2,critical connection network server numbered connected undirected servertoserver connection forming network connectionsi represents connection server server reach server directly indirectly network critical connection connection that removed make server unable reach server return critical connection network order,0,0,0,0,0,0,0,1,0,0
0,delete character make fancy string fancy string string three consecutive character equal given string delete minimum possible number character make fancy return final string deletion shown answer always unique,0,1,0,0,0,0,0,0,0,0
2,minimum move reach target score playing game integer start integer want reach integer target one move either use increment operation number time however use double operation maxdoubles time given two integer target maxdoubles return minimum number move needed reach target starting,0,0,0,1,0,1,0,0,0,0
0,longest happy string string called happy satisfies following condition given three integer return longest possible happy string multiple longest happy string return them string return empty string substring contiguous sequence character within string,0,1,0,0,0,1,0,0,0,0
5,number visible people queue people standing queue numbered left right order given array height distinct integer heightsi represents height ith person person see another person right queue everybody shorter them formally ith person see jth person minheightsi heightsj maxheightsi heightsi heightsj return array answer length answeri number people ith person see right queue,1,0,0,0,0,0,0,0,0,0
0,minimum absolute difference given array distinct integer arr find pair element minimum absolute difference two element return list pair ascending orderwith respect pair pair follows,1,0,0,0,0,0,1,0,0,0
0,ugly number iii ugly number positive integer divisible given four integer return nth ugly number,0,0,0,1,0,0,0,0,0,1
2,smallest string swap given string array pair index string pair pairsi indicates indicesindexed string swap character pair index given pair number time return lexicographically smallest string changed using swap,0,1,0,0,1,0,0,1,1,0
1,sort item group respecting dependency item belonging zero one group groupi group ith item belongs equal ith item belongs group item group zero indexed group item belonging return sorted list item that return solution one solution return empty list solution,0,0,0,0,0,0,0,1,1,0
5,watering plant want water plant garden watering can plant arranged row labeled left right ith plant located river refill watering plant need specific amount water water plant following way initially river take one step move one unit xaxis given indexed integer array plant integer plantsi amount water ith plant need integer capacity representing watering capacity return number step needed water plant,1,0,0,0,0,0,0,0,0,0
2,largest magic square magic square grid filled integer every row sum every column sum diagonal sum equal integer magic square distinct every grid trivially magic square given integer grid return size side length largest magic square found within grid,1,0,0,0,0,0,0,0,0,0
9,count artifact extracted indexed grid artifact buried given integer indexed integer array artifact describing position rectangular artifact artifactsi denotes ith artifact buried subgrid where excavate cell grid remove mud them cell part artifact buried underneath uncovered part artifact uncovered extract given indexed integer array dig digi indicates excavate cell return number artifact extract test case generated that,1,0,0,0,1,0,0,0,0,0
9,count way build room ant colony ant tasked adding new room numbered colony given expansion plan indexed integer array length prevroom prevroomi indicates must build room prevroomi building room two room must connected directly room already built prevroom expansion plan given room built every room reachable room build one room time travel freely room already built connected choose build room long previous room already built return number different order build room since answer may large return modulo,0,0,1,1,0,0,0,0,0,0
0,unique number occurrence given array integer arr return true number occurrence value array unique false otherwise,1,0,0,0,1,0,0,0,0,0
0,remove adjacent duplicate string given string integer duplicate removal consists choosing adjacent equal letter removing them causing left right side deleted substring concatenate together repeatedly make duplicate removal longer can return final string duplicate removal made guaranteed answer unique,0,1,0,0,0,0,0,0,0,0
1,get equal substring within budget given two string length integer maxcost want change changing ith character ith character cost absolute difference ascii value character return maximum length substring changed corresponding substring cost le equal maxcost substring changed corresponding substring return,0,1,0,0,0,0,0,0,0,1
10,minimum move reach target rotation grid snake span cell start moving top left corner grid empty cell represented zero blocked cell represented one snake want reach lower right corner one move snake can return minimum number move reach target way reach target return,1,0,0,0,0,0,0,0,1,0
2,ball fall grid size representing box ball box open top bottom side cell box diagonal board spanning two corner cell redirect ball right left drop one ball top column box ball get stuck box fall bottom ball get stuck hit shaped pattern two board board redirects ball either wall box return array answer size answeri column ball fall bottom dropping ball ith column top ball get stuck box,1,0,1,0,0,0,0,1,0,0
3,sum floored pair given integer array nums return sum floornumsi numsj pair index numslength array since answer may large return modulo floor function return integer part division,1,0,0,1,0,0,0,0,0,1
0,minimum cost move chip position chip position ith chip positioni need move chip position one step change position ith chip positioni return minimum cost needed move chip position,1,0,0,1,0,1,0,0,0,0
0,longest arithmetic subsequence given difference given integer array arr integer difference return length longest subsequence arr arithmetic sequence difference adjacent element subsequence equal difference subsequence sequence derived arr deleting element without changing order remaining element,1,0,1,0,1,0,0,0,0,0
1,path maximum gold gold mine grid size cell mine integer representing amount gold cell empty return maximum amount gold collect condition,1,0,0,0,0,0,0,0,0,0
3,count vowel permutation given integer task count many string length formed following rule since answer may large return modulo,0,0,1,0,0,0,0,0,0,0
3,sort jumbled number given indexed integer array mapping represents mapping rule shuffled decimal system mappingi mean digit mapped digit system mapped value integer new integer obtained replacing occurrence digit integer mappingi also given another integer array nums return array nums sorted nondecreasing order based mapped value element note,1,0,0,0,0,0,1,0,0,0
1,maximum candy allocated child given indexed integer array candy element array denotes pile candy size candiesi divide pile number sub pile cannot merge two pile together also given integer allocate pile candy child child get number candy child take one pile candy pile candy may unused return maximum number candy child get,1,0,0,0,0,0,0,0,0,1
2,maximum product length two palindromic substring given indexed string tasked finding two nonintersecting palindromic substring odd length product length maximized formally want choose four integer slength substring sij skl palindrome odd length sij denotes substring index index inclusive return maximum possible product length two nonintersecting palindromic substring palindrome string forward backward substring contiguous sequence character string,0,1,0,0,0,0,0,0,0,0
0,split string balanced string balanced string equal quantity character given balanced string split maximum amount balanced string return maximum amount split balanced string,0,1,0,0,0,1,0,0,0,0
2,queen attack king chessboard multiple black queen one white king given array integer coordinate queen represents position black queen pair coordinate king represent position white king return coordinate queen order attack king,1,0,0,0,0,0,0,0,0,0
5,dice roll simulation die simulator generates random number roll introduced constraint generator cannot roll number rollmaxi indexed consecutive time given array integer rollmax integer return number distinct sequence obtained exact roll since answer may large return modulo two sequence considered different least one element differs other,1,0,1,0,0,0,0,0,0,0
1,maximum equal frequency given array nums positive integer return longest possible length array prefix nums possible remove exactly one element prefix every number appeared number occurrence removing one element remaining element still considered every appeared number number ocurrences,1,0,0,0,1,0,0,0,0,0
3,maximize topmost element move given indexed integer array nums representing content pile nums topmost element pile one move perform either following also given integer denotes total number move made return maximum value topmost element pile possible exactly move case possible obtain nonempty pile move return,1,0,0,0,0,1,0,0,0,0
0,check straight line given array coordinate coordinatesi represents coordinate point check point make straight line plane,1,0,0,1,0,0,0,0,0,0
0,remove subfolders filesystem given list folder folder return folder removing subfolders folder may return answer order folderi located within another folderj called subfolder format path one concatenated string form followed one lowercase english letter,1,1,0,0,0,0,0,0,0,0
2,replace substring balanced string given string length containing four kind character string said balanced character appears time length string return minimum length substring replaced string length make balanced already balanced return,0,1,0,0,0,0,0,0,0,0
0,maximum profit job scheduling job every job scheduled done starttimei endtimei obtaining profit profiti given starttime endtime profit array return maximum profit take two job subset overlapping time range choose job end time able start another job start time,1,0,1,0,0,0,1,0,0,1
1,find player zero one loss given integer array match matchesi winneri loseri indicates player winneri defeated player loseri match return list answer size where value two list returned increasing order note,1,0,0,0,1,0,1,0,0,0
1,minimum deletion make array beautiful given indexed integer array nums array nums beautiful note empty array considered beautiful delete number element nums delete element element right deleted element shifted one unit left fill gap created element left deleted element remain unchanged return minimum number element delete nums make beautiful,1,0,0,0,0,1,0,0,0,0
0,minimum number move make palindrome given string consisting lowercase english letter one move select two adjacent character swap them return minimum number move needed make palindrome note input generated always converted palindrome,0,1,0,0,0,1,0,0,0,0
0,find positive integer solution given equation given callable function hidden formula value reverse engineer formula return positive integer pair fxy may return pair order exact formula hidden function monotonically increasing function interface defined like this judge solution follows,0,0,0,1,0,0,0,0,0,1
6,circular permutation binary representation given integer start task return permutation,0,0,0,1,0,0,0,0,0,0
0,maximum length concatenated string unique character given array string arr string formed concatenation subsequence arr unique character return maximum possible length subsequence array derived another array deleting element without changing order remaining element,1,1,0,0,0,0,0,0,0,0
0,tiling rectangle fewest square given rectangle size return minimum number integersided square tile rectangle,0,0,1,0,0,0,0,0,0,0
0,airplane seat assignment probability passenger board airplane exactly seat first passenger lost ticket pick seat randomly that rest passenger will return probability nth person get seat,0,0,1,1,0,0,0,0,0,0
0,tuple product given array nums distinct positive integer return number tuples element nums,1,0,0,0,1,0,0,0,0,0
1,maximum height stacking cuboid given cuboid dimension ith cuboid cuboidsi widthi lengthi heighti indexed choose subset cuboid place other place cuboid cuboid widthi widthj lengthi lengthj heighti heightj rearrange cuboid dimension rotating put another cuboid return maximum height stacked cuboid,1,0,1,0,0,0,1,0,0,0
7,minimum swap make string equal given two string equal length consisting letter only task make two string equal other swap two character belong different string mean swap return minimum number swap required make equal return impossible,0,1,0,1,0,1,0,0,0,0
0,count number nice subarrays given array integer nums integer continuous subarray called nice odd number return number nice subarrays,1,0,0,1,1,0,0,0,0,0
0,minimum remove make valid parenthesis given string lowercase english character task remove minimum number parenthesis position resulting parenthesis string valid return valid string formally parenthesis string valid,0,1,0,0,0,0,0,0,0,0
1,check good array given array nums positive integer task select subset nums multiply element integer add number array said good obtain sum array possible subset multiplicand return true array good otherwise return false,1,0,0,1,0,0,0,0,0,0
1,find palindrome fixed length given integer array query positive integer intlength return array answer answeri either queriesith smallest positive palindrome length intlength palindrome exists palindrome number read backwards forward palindrome cannot leading zero,1,0,0,1,0,0,0,0,0,0
3,cell odd value matrix matrix initialized also array index indicesi represents indexed location perform increment operation matrix location indicesi following given index return number oddvalued cell matrix applying increment location index,1,0,0,1,0,0,0,0,0,0
4,reconstruct row binary matrix given following detail matrix column row task reconstruct matrix upper lower colsum return integer array one valid solution accepted valid solution exists return empty array,1,0,0,0,0,1,0,0,0,0
6,number closed island given grid consists land water island maximal directionally connected group closed island island totally all left top right bottom surrounded return number closed island,1,0,0,0,0,0,0,1,1,0
3,maximum score word formed letter given list word list single letter might repeating score every character return maximum score valid set word formed using given letter wordsi cannot used two time necessary use character letter letter used once score letter given score score score respectively,1,1,1,0,0,0,0,0,0,0
3,shift grid given grid size integer need shift grid time one shift operation return grid applying shift operation time,1,0,0,0,0,0,0,0,0,0
1,find element contaminated binary tree given binary tree following rule binary tree contaminated mean treenodeval changed implement findelements class,0,0,0,0,1,0,0,1,1,0
0,greatest sum divisible three given array nums integer need find maximum possible sum element array divisible three,1,0,1,0,0,1,0,0,0,0
1,minimum move move box target location storekeeper game player push box around warehouse trying get target location game represented grid character grid element wall floor box task move box target position following rule return minimum number push move box target way reach target return,1,0,0,0,0,0,0,0,1,0
4,find difference two array given two indexed integer array nums nums return list answer size where note integer list may returned order,1,0,0,0,1,0,0,0,0,0
0,maximum value coin pile pile coin table pile consists positive number coin assorted denomination one move choose coin top pile remove add wallet given list pile pilesi list integer denoting composition ith pile top bottom positive integer return maximum total value coin wallet choose exactly coin optimally,1,0,1,0,0,0,0,0,0,0
1,minimum time visiting point plane point integer coordinate pointsi return minimum time second visit point order given point move according rule,1,0,0,1,0,0,0,0,0,0
2,count server communicate given map server center represented integer matrix grid mean cell server mean server two server said communicate row column return number server communicate server,1,0,0,0,0,0,0,1,1,0
0,search suggestion system given array string product string searchword design system suggests three product name product character searchword typed suggested product common prefix searchword three product common prefix return three lexicographically minimum product return list list suggested product character searchword typed,1,1,0,0,0,0,0,0,0,0
6,number way stay place step pointer index array size arrlen step move position left position right array stay place the pointer placed outside array time given two integer step arrlen return number way pointer still index exactly step step since answer may large return modulo,0,0,1,0,0,0,0,0,0,0
3,find winner tic tac toe game tictactoe played two player grid rule tictactoe are given integer array move movesi rowi coli indicates ith move played gridrowicoli return winner game exists case game end draw return draw still movement play return pending assume move valid follows rule tictactoe grid initially empty play first,1,0,0,0,1,0,0,0,0,0
3,number burger waste ingredient given two integer tomatoslices cheeseslices ingredient different burger follows return totaljumbo totalsmall number remaining tomatoslices equal number remaining cheeseslices equal possible make remaining tomatoslices cheeseslices equal return,0,0,0,1,0,0,0,0,0,0
0,count square submatrices one given matrix one zero return many square submatrices one,1,0,1,0,0,0,0,0,0,0
0,palindrome partitioning iii given string containing lowercase letter integer need return minimal number character need change divide string,0,1,1,0,0,0,0,0,0,0
6,group people given group size belong people split unknown number group person labeled unique given integer array groupsizes groupsizesi size group person example groupsizes person must group size return list group person group size groupsizesi person appear exactly one group every person must group multiple answer return them guaranteed least one valid solution given input,1,0,0,0,1,0,0,0,0,0
6,find smallest divisor given threshold given array integer nums integer threshold choose positive integer divisor divide array sum division result find smallest divisor result mentioned le equal threshold result division rounded nearest integer greater equal element for example test case generated answer,1,0,0,0,0,0,0,0,0,1
8,minimum number flip convert binary matrix zero matrix given binary matrix mat one step choose one cell flip four neighbor exist flip changing pair cell called neighbor share one edge return minimum number step required convert mat zero matrix cannot binary matrix matrix cell equal only zero matrix matrix cell equal,1,0,0,0,0,0,0,0,1,0
2,convert binary number linked list integer given head reference node singlylinked list value node linked list either linked list hold binary representation number return decimal value number linked list,0,0,0,1,0,0,0,0,0,0
1,maximum side length square sum le equal threshold given matrix mat integer threshold return maximum sidelength square sum le equal threshold return square,1,0,0,0,0,0,0,0,0,1
7,shortest path grid obstacle elimination given integer matrix grid cell either empty obstacle move down left right empty cell one step return minimum number step walk upper left corner lower right corner given eliminate obstacle possible find walk return,1,0,0,0,0,0,0,0,1,0
0,find number even number digit given array nums integer return many contain even number digit,1,0,0,0,0,0,0,0,0,0
0,divide array set consecutive number given array integer nums positive integer check whether possible divide array set consecutive number return true possible otherwise return false,1,0,0,0,1,1,1,0,0,0
0,maximum number occurrence substring given string return maximum number ocurrences substring following rule,0,1,0,0,1,0,0,0,0,0
2,maximum candy get box box labeled given four array status candy key containedboxes where given integer array initialboxes contains label box initially have take candy open box use key open new box also use box find return maximum number candy get following rule above,1,0,0,0,0,0,0,0,1,0
1,find unique integer sum zero given integer return array containing unique integer add,1,0,0,1,0,0,0,0,0,0
2,element two binary search tree given two binary search tree root root return list containing integer tree sorted ascending order,0,0,0,0,0,0,1,1,0,0
1,jump game iii given array nonnegative integer arr initially positioned start index array index jump arri arri check reach index value notice jump outside array time,1,0,0,0,0,0,0,1,1,0
0,verbal arithmetic puzzle given equation represented word left side result right side need check equation solvable following rule return true equation solvable otherwise return false,1,1,0,1,0,0,0,0,0,0
